<?xml version="1.0" encoding="UTF-8"?>
<Type_0x43 messageNo="0" messageSequenceNo="0"
	messageSerialNo="0" xmlns="http://www.example.org/msg_0x43" xmlns:u="http://www.example.org/UType"
	xmlns:xsi="http://www.w3.org/2001/XMLSchema-instance"
	xsi:schemaLocation="http://www.example.org/msg_0x43 ../xsd/msg_0x43.xsd ">
	<APP_Attack_Types>
		<APP_Attack>
			<APP_Attack_Type>0</APP_Attack_Type>
			<Attack_Threshold>0</Attack_Threshold>
			<Attack_Control>0</Attack_Control>
		</APP_Attack>
		<APP_Attack>
			<APP_Attack_Type>0</APP_Attack_Type>
			<Attack_Threshold>0</Attack_Threshold>
			<Attack_Control>0</Attack_Control>
		</APP_Attack>
	</APP_Attack_Types>
	<MessageSerialNo>00000000</MessageSerialNo>
</Type_0x43>
